[
  {
    "id": "talk",
    "name": "话术",
    "description": "通过表达、劝说和交涉影响他人的判断。",
    "initial": false,
    "autoTrigger": {
      "sum": ["education", "insight"],
      "operator": "gte",
      "value": 14
    }
  },
  {
    "id": "stealth",
    "name": "潜行",
    "description": "降低行动时产生的声响，避免被敌人发现。",
    "initial": false,
    "autoTrigger": {
      "sum": ["agility", "strength"],
      "operator": "gte",
      "value": 14
    }
  },
  {
    "id": "throwing",
    "name": "投掷",
    "description": "将物品准确投向目标位置或利用声响转移敌人注意。",
    "initial": false
  },
  {
    "id": "medicine",
    "name": "医学",
    "description": "运用医学知识判断伤势、死因和死亡时间。",
    "initial": false,
    "autoTrigger": {
      "attribute": "education",
      "operator": "gt",
      "value": 5
    }
  },
  {
    "id": "scouting",
    "name": "侦查",
    "description": "搜索环境、发现隐藏线索并判断潜在危险。",
    "initial": false
  }
]
